{
  "planName": "健康周报",
  "planTitle": "这周的健康情况，我们一起看一看",
  "planSummary": "这周已经有一些血糖、血压、饮食和运动记录，能帮助我们看见近期管理方向：血糖血压仍需要持续关注，早餐和散步等好习惯可以继续保留；因为记录还不够连续，下周先把关键记录补齐，让判断更可靠。",
  "executionPoints": "下周先稳住两件事：继续记录空腹/餐后血糖和血压，同时把饮食、运动和不适感受简单记下来；如果指标连续偏高、出现低血糖表现或明显不舒服，请及时联系医生或健管师。",
  "groups": [
    {
      "groupTitle": "本周健康概览",
      "groupType": "adviceList",
      "groupSummary": "这周已经留下了几类关键记录，可以帮助我们看见管理方向。",
      "displayStyle": "list",
      "dietPlanGoalLabel": "",
      "goalBasis": "近7天有血糖、血压、饮食、运动和随访记录。",
      "items": [
        {
          "itemType": "advice",
          "day": "",
          "title": "这周已经有了关键记录",
          "content": "这周记录到了血糖、血压、饮食、运动和取药信息，已经能看出血糖血压仍需要继续关注；同时，您也有无糖早餐、快走和散步这些值得保留的好习惯。",
          "focusPoint": "已有记录能帮助发现方向，连续记录更适合判断趋势。",
          "importance": "重点执行",
          "dailyTotalKcal": "",
          "dailyTotalProteinG": "",
          "dailyTotalFatG": "",
          "estimatedEnergyDeficitKcal": "",
          "meals": []
        }
      ]
    },
    {
      "groupTitle": "指标变化总结",
      "groupType": "adviceList",
      "groupSummary": "血糖和血压是这周最需要继续观察的指标。",
      "displayStyle": "list",
      "dietPlanGoalLabel": "",
      "goalBasis": "空腹血糖8.1 mmol/L、餐后2小时血糖13.6 mmol/L、血压148/92 mmHg。",
      "items": [
        {
          "itemType": "advice",
          "day": "",
          "title": "血糖血压需要温和地盯紧",
          "content": "这周已有记录高于目标范围，说明血糖和血压还需要继续观察。下周先把空腹、餐后2小时血糖和血压记得更连续，医生或健管师就能更准确地判断变化。",
          "focusPoint": "不用因为单次结果紧张，但连续偏高时要及时反馈。",
          "importance": "重点执行",
          "dailyTotalKcal": "",
          "dailyTotalProteinG": "",
          "dailyTotalFatG": "",
          "estimatedEnergyDeficitKcal": "",
          "meals": []
        }
      ]
    },
    {
      "groupTitle": "饮食执行总结",
      "groupType": "adviceList",
      "groupSummary": "本周早餐选择里有值得保留的好习惯，晚餐外卖可以继续微调。",
      "displayStyle": "list",
      "dietPlanGoalLabel": "",
      "goalBasis": "近7天饮食记录包含外卖盖饭和无糖豆浆、鸡蛋、全麦面包。",
      "items": [
        {
          "itemType": "advice",
          "day": "",
          "title": "早餐做得不错，晚餐再轻一点",
          "content": "鸡蛋、无糖豆浆和全麦面包是比较友好的早餐组合，可以继续保留；晚餐外卖时先留意主食份量和油脂，下周记录一下吃完后的血糖感受。",
          "focusPoint": "周报只总结执行情况，不生成新的菜谱。",
          "importance": "常规建议",
          "dailyTotalKcal": "",
          "dailyTotalProteinG": "",
          "dailyTotalFatG": "",
          "estimatedEnergyDeficitKcal": "",
          "meals": []
        }
      ]
    },
    {
      "groupTitle": "运动执行总结",
      "groupType": "adviceList",
      "groupSummary": "本周已经有快走和散步记录，先把安全和连续性放在前面。",
      "displayStyle": "list",
      "dietPlanGoalLabel": "",
      "goalBasis": "近7天运动记录包含25分钟快走和15分钟散步。",
      "items": [
        {
          "itemType": "advice",
          "day": "",
          "title": "运动从能坚持的小步开始",
          "content": "这周已有快走和散步记录，而且没有明显不适，这是很好的起点。夜班后疲劳时不用勉强加量，下周先记录运动时间和身体感受。",
          "focusPoint": "先保证安全和连续，再逐步看是否需要增加活动量。",
          "importance": "常规建议",
          "dailyTotalKcal": "",
          "dailyTotalProteinG": "",
          "dailyTotalFatG": "",
          "estimatedEnergyDeficitKcal": "",
          "meals": []
        }
      ]
    },
    {
      "groupTitle": "风险提醒与下周关注",
      "groupType": "adviceList",
      "groupSummary": "下周重点是把记录做得更连续，同时留意需要及时反馈的异常信号。",
      "displayStyle": "list",
      "dietPlanGoalLabel": "",
      "goalBasis": "随访记录提示夜班后空腹血糖偏高，且本周已有血糖血压偏高记录。",
      "items": [
        {
          "itemType": "advice",
          "day": "",
          "title": "有不舒服别硬扛",
          "content": "如果下周连续出现血糖或血压明显偏高、低血糖表现、胸闷胸痛、明显头晕或用药中断，请及时联系医生或健管师，不用等到下一次周报。",
          "focusPoint": "周报帮助看趋势，但明显不适和连续异常要优先处理。",
          "importance": "重点执行",
          "dailyTotalKcal": "",
          "dailyTotalProteinG": "",
          "dailyTotalFatG": "",
          "estimatedEnergyDeficitKcal": "",
          "meals": []
        }
      ]
    }
  ]
}
